Capstone/Analisis_matriz_eje_vertical/Etapa_4A_matriz_y_arbol_principal/resultados/casos_criticos_correlacionados.csv

evento,paso,tiempo_s,angulo_grados,F1_N,F2_N,Fz_normal_N,Mx_normales_Nm,My_normales_Nm,M_flexion_normales_Nm,T_resistente_3C_Nm,F_tangencial_neta_aprox_y_N,P_resistente_W
max_fuerza_total,1097.0,0.0885820413436692,274.25,7970.904104062793,6100.083372878474,14070.987476941267,-1.510920127594083,131.55712184958975,131.56579794528582,88.9239657914494,187.0820731184319,4805.041495725985
max_torque,377.0,0.0304425064599483,94.25,6100.083372899466,7970.904104041699,14070.987476941165,1.5109201275560666,-131.55712184714298,131.56579794283877,88.92396579145439,-187.0820731142233,4805.041495726255
max_momento_normales,1077.0,0.0869670542635659,269.25,7676.81676447442,5187.05204855274,12863.86881302716,1.182561373890747,153.79696984888432,153.80151620221972,79.06317549050948,248.97647159216797,4272.209810196001
max_VM_eje_d35,377.0,0.0304425064599483,94.25,6100.083372899466,7970.904104041699,14070.987476941165,1.5109201275560666,-131.55712184714298,131.56579794283877,88.92396579145439,-187.0820731142233,4805.041495726255

Capstone/Analisis_matriz_eje_vertical/Etapa_4A_matriz_y_arbol_principal/resultados/informe_resultados.md

## Historial simultáneo: extremos

- **max_fuerza_total**: paso 1097, ángulo 274.25°; Fz=14.071 kN, T=88.924 N·m,  Mx=-1.511 N·m, My=131.557 N·m, |M|=131.566 N·m
- **max_torque**: paso 377, ángulo 94.25°; Fz=14.071 kN, T=88.924 N·m,  Mx=1.511 N·m, My=-131.557 N·m, |M|=131.566 N·m
- **max_momento_normales**: paso 1077, ángulo 269.25°; Fz=12.864 kN, T=79.063 N·m,  Mx=1.183 N·m, My=153.797 N·m, |M|=153.802 N·m
- **max_VM_eje_d35**: paso 377, ángulo 94.25°; Fz=14.071 kN, T=88.924 N·m,  Mx=1.511 N·m, My=-131.557 N·m, |M|=131.566 N·m