Capstone/Analisis_matriz_eje_vertical/Etapa_4B_matriz_arbol_condicional/resultados/instantes_criticos_correlacionados.csv

caso,angulo_grados,Fz_kN,T_Nm,M_normal_Nm,Mx_Nm,My_Nm,Fy_lateral_modelo_N
Fz_max,274.25,14.070987476941268,88.9239657914494,131.56579794528582,-1.510920127594083,131.55712184958975,187.0820731184319
T_res_max,94.25,14.070987476941163,88.92396579145439,131.56579794283877,1.5109201275560666,-131.55712184714298,-187.0820731142233
M_normal_max,269.25,12.86386881302716,79.06317549050948,153.80151620221972,1.182561373890747,153.79696984888432,248.976471592168
F_t_lateral_mod_max_abs,89.49999999999999,12.743037689049896,78.17426050806239,153.6280093595897,-0.9169625866999273,-153.62527278870743,-250.00628928682335

Capstone/Analisis_matriz_eje_vertical/Etapa_4A_matriz_y_arbol_principal/resultados/informe_resultados.md

## Historial simultáneo: extremos

- **max_fuerza_total**: paso 1097, ángulo 274.25°; Fz=14.071 kN, T=88.924 N·m,  Mx=-1.511 N·m, My=131.557 N·m, |M|=131.566 N·m
- **max_torque**: paso 377, ángulo 94.25°; Fz=14.071 kN, T=88.924 N·m,  Mx=1.511 N·m, My=-131.557 N·m, |M|=131.566 N·m
- **max_momento_normales**: paso 1077, ángulo 269.25°; Fz=12.864 kN, T=79.063 N·m,  Mx=1.183 N·m, My=153.797 N·m, |M|=153.802 N·m
- **max_VM_eje_d35**: paso 377, ángulo 94.25°; Fz=14.071 kN, T=88.924 N·m,  Mx=1.511 N·m, My=-131.557 N·m, |M|=131.566 N·m